{
  "$schema": "../schema/channel.schema.json",
  "schemaVersion": 2,
  "billingProvider": "阿里云百炼",
  "accessChannel": {
    "id": "aliyun-bailian-token-plan-personal",
    "name": "阿里云百炼 Token Plan 个人版",
    "kind": "plan"
  },
  "sourceReferences": [
    "https://help.aliyun.com/zh/model-studio/token-plan-personal-overview"
  ]
}
