{
  "$schema": "../schema/channel.schema.json",
  "schemaVersion": 2,
  "billingProvider": "百度智能云千帆",
  "accessChannel": {
    "id": "baidu-qianfan-payg-api",
    "name": "百度千帆按量后付费模型 API",
    "kind": "metered_api"
  },
  "sourceReferences": [
    "https://cloud.baidu.com/product/qianfan_home/campaign.html?track=home_banner"
  ]
}
