{
  "$schema": "../schema/channel.schema.json",
  "schemaVersion": 2,
  "billingProvider": "阿里云（Qoder CN）",
  "accessChannel": {
    "id": "qoder-cn-service-account",
    "name": "Qoder CN Service Account 按量后付费",
    "kind": "metered_api"
  },
  "sourceReferences": [
    "https://docs.qoder.cn/enterprise/service-account",
    "https://docs.qoder.cn/product-overview/billing-description"
  ]
}
