{
  "$schema": "../schema/channel.schema.json",
  "schemaVersion": 2,
  "billingProvider": "Nanonoble Pte. Ltd. (MiniMax)",
  "accessChannel": {
    "id": "minimax-m-plan-international",
    "name": "MiniMax M Plan 国际版",
    "kind": "plan"
  },
  "sourceReferences": [
    "https://platform.minimax.io/docs/m-plan/monthly-offer",
    "https://platform.minimax.io/protocol/paid-agreement",
    "https://platform.minimax.io/protocol/terms-of-service"
  ]
}
